{
  "$schema": "../../../schemas/pack.schema.json",
  "schemaVersion": 1,
  "id": "istoreos",
  "version": "2.0.0",
  "layer": "distribution",
  "extends": ["openwrt"],
  "match": {
    "osFamily": "openwrt",
    "distribution": "istoreos"
  },
  "skillsRoot": "skills",
  "requires": ["target-shell:posix"]
}
