{
  "$schema": "../../../schemas/pack.schema.json",
  "schemaVersion": 1,
  "id": "windows",
  "version": "1.0.0",
  "layer": "family",
  "extends": ["common"],
  "match": {
    "osFamily": "windows",
    "distribution": "windows"
  },
  "skillsRoot": "skills",
  "requires": ["target-shell:powershell"]
}
